{
  "$id": "https://posthog-impact.local/schemas/review_intervention_candidates.schema.json",
  "$schema": "https://json-schema.org/draft/2020-12/schema",
  "additionalProperties": false,
  "properties": {
    "author_replied_in_thread": {
      "arrow_type": "bool",
      "type": [
        "boolean",
        "null"
      ]
    },
    "body_length": {
      "arrow_type": "int64",
      "type": [
        "integer",
        "null"
      ]
    },
    "body_text": {
      "arrow_type": "string",
      "type": [
        "string",
        "null"
      ]
    },
    "candidate_id": {
      "arrow_type": "string",
      "type": [
        "string",
        "null"
      ]
    },
    "comment_id": {
      "arrow_type": "string",
      "type": [
        "string",
        "null"
      ]
    },
    "commenter_actor_id": {
      "arrow_type": "string",
      "type": [
        "string",
        "null"
      ]
    },
    "commenter_is_bot": {
      "arrow_type": "bool",
      "type": [
        "boolean",
        "null"
      ]
    },
    "commenter_login": {
      "arrow_type": "string",
      "type": [
        "string",
        "null"
      ]
    },
    "component": {
      "arrow_type": "string",
      "type": [
        "string",
        "null"
      ]
    },
    "created_at": {
      "arrow_type": "string",
      "type": [
        "string",
        "null"
      ]
    },
    "follow_evidence": {
      "arrow_type": "string",
      "type": [
        "string",
        "null"
      ]
    },
    "followed_by_change_in_path": {
      "arrow_type": "bool",
      "type": [
        "boolean",
        "null"
      ]
    },
    "has_safety_vocabulary": {
      "arrow_type": "bool",
      "type": [
        "boolean",
        "null"
      ]
    },
    "is_intervention_candidate": {
      "arrow_type": "bool",
      "type": [
        "boolean",
        "null"
      ]
    },
    "is_self_comment": {
      "arrow_type": "bool",
      "type": [
        "boolean",
        "null"
      ]
    },
    "is_substantive": {
      "arrow_type": "bool",
      "type": [
        "boolean",
        "null"
      ]
    },
    "is_thread_opener": {
      "arrow_type": "bool",
      "type": [
        "boolean",
        "null"
      ]
    },
    "matched_ack_pattern": {
      "arrow_type": "string",
      "type": [
        "string",
        "null"
      ]
    },
    "matched_nit_pattern": {
      "arrow_type": "string",
      "type": [
        "string",
        "null"
      ]
    },
    "path": {
      "arrow_type": "string",
      "type": [
        "string",
        "null"
      ]
    },
    "position_in_thread": {
      "arrow_type": "int64",
      "type": [
        "integer",
        "null"
      ]
    },
    "pr_author_actor_id": {
      "arrow_type": "string",
      "type": [
        "string",
        "null"
      ]
    },
    "pr_id": {
      "arrow_type": "string",
      "type": [
        "string",
        "null"
      ]
    },
    "pr_number": {
      "arrow_type": "int64",
      "type": [
        "integer",
        "null"
      ]
    },
    "review_intervention_version": {
      "arrow_type": "string",
      "type": [
        "string",
        "null"
      ]
    },
    "safety_categories": {
      "arrow_type": "list<element: string>",
      "type": [
        "array",
        "null"
      ]
    },
    "safety_terms_matched": {
      "arrow_type": "struct<breaking_change: list<element: string>, correctness: list<element: string>, data_loss: list<element: string>, migration: list<element: string>, performance: list<element: string>, privacy: list<element: string>, scaling: list<element: string>, security: list<element: string>, test_gap: list<element: string>, ux: list<element: string>>",
      "type": [
        "object",
        "null"
      ]
    },
    "substance_class": {
      "arrow_type": "string",
      "type": [
        "string",
        "null"
      ]
    },
    "substance_reasons": {
      "arrow_type": "list<element: string>",
      "type": [
        "array",
        "null"
      ]
    },
    "thread_comment_count": {
      "arrow_type": "int64",
      "type": [
        "integer",
        "null"
      ]
    },
    "thread_id": {
      "arrow_type": "string",
      "type": [
        "string",
        "null"
      ]
    },
    "thread_is_outdated": {
      "arrow_type": "bool",
      "type": [
        "boolean",
        "null"
      ]
    },
    "thread_is_resolved": {
      "arrow_type": "bool",
      "type": [
        "boolean",
        "null"
      ]
    },
    "thread_resolved_by_author": {
      "arrow_type": "bool",
      "type": [
        "boolean",
        "null"
      ]
    },
    "thread_resolved_by_login": {
      "arrow_type": "string",
      "type": [
        "string",
        "null"
      ]
    },
    "url": {
      "arrow_type": "string",
      "type": [
        "string",
        "null"
      ]
    }
  },
  "title": "review_intervention_candidates",
  "type": "object",
  "x-pipeline-version": "1.0.0",
  "x-schema-version": "1.0.0"
}
