[
  {
    "author_replied_in_thread": false,
    "body_length": 529,
    "body_text": "Source dev defaults in start-backend\nWhen bin/start-backend is run directly (or via mprocs --config ... without bin/start), this script no longer loads .env.development, so defaults like SESSION_RECOR",
    "candidate_id": "45696:PRRC_kwDODg-Tdc6h8bEm",
    "comment_id": "PRRC_kwDODg-Tdc6h8bEm",
    "commenter_actor_id": "github/user/chatgpt-codex-connector",
    "commenter_is_bot": true,
    "commenter_login": "chatgpt-codex-connector",
    "component": "infra:scripts",
    "created_at": "2026-01-22T13:41:38Z",
    "follow_evidence": "1 commit(s) after the comment; referenced path is in the merged diff",
    "followed_by_change_in_path": true,
    "has_safety_vocabulary": true,
    "is_intervention_candidate": false,
    "is_self_comment": false,
    "is_substantive": false,
    "is_thread_opener": true,
    "matched_ack_pattern": null,
    "matched_nit_pattern": null,
    "path": "bin/start-backend",
    "position_in_thread": 0,
    "pr_author_actor_id": "github/user/webjunkie",
    "pr_id": "github.com/PostHog/posthog#pr/45696",
    "pr_number": 45696,
    "review_intervention_version": "1.0.0",
    "safety_categories": [
      "correctness"
    ],
    "safety_terms_matched": {
      "breaking_change": null,
      "correctness": [
        "bug"
      ],
      "data_loss": null,
      "migration": null,
      "performance": null,
      "privacy": null,
      "scaling": null,
      "security": null,
      "test_gap": null,
      "ux": null
    },
    "substance_class": "bot",
    "substance_reasons": [
      "author is a bot account"
    ],
    "thread_comment_count": 1,
    "thread_id": "PRRT_kwDODg-Tdc5qjXrt",
    "thread_is_outdated": true,
    "thread_is_resolved": true,
    "thread_resolved_by_author": false,
    "thread_resolved_by_login": "posthog-bot-comment-resolver[bot]",
    "url": "https://github.com/PostHog/posthog/pull/45696#discussion_r2716971302"
  },
  {
    "author_replied_in_thread": true,
    "body_length": 1928,
    "body_text": "If .env.local contains op:// references but the op CLI is not available, the script prints a warning (line 24-25) but continues execution. Then this block sources .env.local directly, setting literal ",
    "candidate_id": "45696:PRRC_kwDODg-Tdc6jCsxE",
    "comment_id": "PRRC_kwDODg-Tdc6jCsxE",
    "commenter_actor_id": "github/user/graphite-app",
    "commenter_is_bot": true,
    "commenter_login": "graphite-app",
    "component": "infra:scripts",
    "created_at": "2026-01-28T08:19:01Z",
    "follow_evidence": "1 commit(s) after the comment; referenced path is in the merged diff",
    "followed_by_change_in_path": true,
    "has_safety_vocabulary": true,
    "is_intervention_candidate": false,
    "is_self_comment": false,
    "is_substantive": false,
    "is_thread_opener": true,
    "matched_ack_pattern": null,
    "matched_nit_pattern": null,
    "path": "bin/start",
    "position_in_thread": 0,
    "pr_author_actor_id": "github/user/webjunkie",
    "pr_id": "github.com/PostHog/posthog#pr/45696",
    "pr_number": 45696,
    "review_intervention_version": "1.0.0",
    "safety_categories": [
      "correctness",
      "security"
    ],
    "safety_terms_matched": {
      "breaking_change": null,
      "correctness": [
        "null"
      ],
      "data_loss": null,
      "migration": null,
      "performance": null,
      "privacy": null,
      "scaling": null,
      "security": [
        "secret",
        "credential"
      ],
      "test_gap": null,
      "ux": null
    },
    "substance_class": "bot",
    "substance_reasons": [
      "author is a bot account"
    ],
    "thread_comment_count": 3,
    "thread_id": "PRRT_kwDODg-Tdc5rYhZW",
    "thread_is_outdated": false,
    "thread_is_resolved": false,
    "thread_resolved_by_author": null,
    "thread_resolved_by_login": null,
    "url": "https://github.com/PostHog/posthog/pull/45696#discussion_r2735393860"
  },
  {
    "author_replied_in_thread": false,
    "body_length": 1486,
    "body_text": "The code calls os.execvp(\"op\", ...) without checking if the op command exists. If 1Password CLI is not installed but .env.local contains op:// references, this will crash with FileNotFoundError: [Errn",
    "candidate_id": "45696:PRRC_kwDODg-Tdc6jCsyj",
    "comment_id": "PRRC_kwDODg-Tdc6jCsyj",
    "commenter_actor_id": "github/user/graphite-app",
    "commenter_is_bot": true,
    "commenter_login": "graphite-app",
    "component": "common:hogli",
    "created_at": "2026-01-28T08:19:03Z",
    "follow_evidence": "1 commit(s) after the comment; referenced path is not in the merged diff",
    "followed_by_change_in_path": false,
    "has_safety_vocabulary": false,
    "is_intervention_candidate": false,
    "is_self_comment": false,
    "is_substantive": false,
    "is_thread_opener": true,
    "matched_ack_pattern": null,
    "matched_nit_pattern": null,
    "path": "common/hogli/core/cli.py",
    "position_in_thread": 0,
    "pr_author_actor_id": "github/user/webjunkie",
    "pr_id": "github.com/PostHog/posthog#pr/45696",
    "pr_number": 45696,
    "review_intervention_version": "1.0.0",
    "safety_categories": [],
    "safety_terms_matched": {
      "breaking_change": null,
      "correctness": null,
      "data_loss": null,
      "migration": null,
      "performance": null,
      "privacy": null,
      "scaling": null,
      "security": null,
      "test_gap": null,
      "ux": null
    },
    "substance_class": "bot",
    "substance_reasons": [
      "author is a bot account"
    ],
    "thread_comment_count": 1,
    "thread_id": "PRRT_kwDODg-Tdc5rYhal",
    "thread_is_outdated": true,
    "thread_is_resolved": true,
    "thread_resolved_by_author": false,
    "thread_resolved_by_login": "posthog-bot-comment-resolver[bot]",
    "url": "https://github.com/PostHog/posthog/pull/45696#discussion_r2735393955"
  },
  {
    "author_replied_in_thread": false,
    "body_length": 141,
    "body_text": "If .env.local contains op:// references but the op CLI is not available\n\nYeah well who would use .env.local that way when they don't have op.",
    "candidate_id": "45696:PRRC_kwDODg-Tdc6jDYsG",
    "comment_id": "PRRC_kwDODg-Tdc6jDYsG",
    "commenter_actor_id": "github/user/webjunkie",
    "commenter_is_bot": false,
    "commenter_login": "webjunkie",
    "component": "infra:scripts",
    "created_at": "2026-01-28T09:05:37Z",
    "follow_evidence": "1 commit(s) after the comment; referenced path is in the merged diff",
    "followed_by_change_in_path": true,
    "has_safety_vocabulary": false,
    "is_intervention_candidate": false,
    "is_self_comment": true,
    "is_substantive": true,
    "is_thread_opener": false,
    "matched_ack_pattern": null,
    "matched_nit_pattern": null,
    "path": "bin/start",
    "position_in_thread": 1,
    "pr_author_actor_id": "github/user/webjunkie",
    "pr_id": "github.com/PostHog/posthog#pr/45696",
    "pr_number": 45696,
    "review_intervention_version": "1.0.0",
    "safety_categories": [],
    "safety_terms_matched": {
      "breaking_change": null,
      "correctness": null,
      "data_loss": null,
      "migration": null,
      "performance": null,
      "privacy": null,
      "scaling": null,
      "security": null,
      "test_gap": null,
      "ux": null
    },
    "substance_class": "substantive",
    "substance_reasons": [
      "contains suggestion/argument language"
    ],
    "thread_comment_count": 3,
    "thread_id": "PRRT_kwDODg-Tdc5rYhZW",
    "thread_is_outdated": false,
    "thread_is_resolved": false,
    "thread_resolved_by_author": null,
    "thread_resolved_by_login": null,
    "url": "https://github.com/PostHog/posthog/pull/45696#discussion_r2735573766"
  },
  {
    "author_replied_in_thread": false,
    "body_length": 629,
    "body_text": "When using op run, the command inherits the environment where .env.development was already loaded. However, op run --env-file will override those values with what's in .env.local. The problem: if .env",
    "candidate_id": "45696:PRRC_kwDODg-Tdc6jDtE7",
    "comment_id": "PRRC_kwDODg-Tdc6jDtE7",
    "commenter_actor_id": "github/user/graphite-app",
    "commenter_is_bot": true,
    "commenter_login": "graphite-app",
    "component": "common:hogli",
    "created_at": "2026-01-28T09:23:05Z",
    "follow_evidence": "1 commit(s) after the comment; referenced path is not in the merged diff",
    "followed_by_change_in_path": false,
    "has_safety_vocabulary": true,
    "is_intervention_candidate": false,
    "is_self_comment": false,
    "is_substantive": false,
    "is_thread_opener": true,
    "matched_ack_pattern": null,
    "matched_nit_pattern": null,
    "path": "common/hogli/core/cli.py",
    "position_in_thread": 0,
    "pr_author_actor_id": "github/user/webjunkie",
    "pr_id": "github.com/PostHog/posthog#pr/45696",
    "pr_number": 45696,
    "review_intervention_version": "1.0.0",
    "safety_categories": [
      "security"
    ],
    "safety_terms_matched": {
      "breaking_change": null,
      "correctness": null,
      "data_loss": null,
      "migration": null,
      "performance": null,
      "privacy": null,
      "scaling": null,
      "security": [
        "secret"
      ],
      "test_gap": null,
      "ux": null
    },
    "substance_class": "bot",
    "substance_reasons": [
      "author is a bot account"
    ],
    "thread_comment_count": 1,
    "thread_id": "PRRT_kwDODg-Tdc5rZQlv",
    "thread_is_outdated": true,
    "thread_is_resolved": true,
    "thread_resolved_by_author": true,
    "thread_resolved_by_login": "webjunkie",
    "url": "https://github.com/PostHog/posthog/pull/45696#discussion_r2735657275"
  },
  {
    "author_replied_in_thread": true,
    "body_length": 114,
    "body_text": "Welp, I think it makes sense to fail if we detect op:// (maybe shared by a colleague?) and op is not installed yet",
    "candidate_id": "45696:PRRC_kwDODg-Tdc6jhsIL",
    "comment_id": "PRRC_kwDODg-Tdc6jhsIL",